{
  "job_id": "00000000-0000-4000-8000-000000000001",
  "stage": "01_INGEST",
  "config_source": "public",
  "config_version": "v1",
  "model": "not_reported",
  "execution_id": "exec-0001",
  "created_at": "2026-10-22T12:00:00Z",
  "images": [
    {
      "ref": "img://job-0001/0",
      "provenance": "generated_illustration",
      "subject": "none",
      "attribution": "Gerada por modelo de imagem sintético",
      "seal": "applied",
      "alt_text": "Ilustração abstrata em tons escuros."
    },
    {
      "ref": "img://job-0001/1",
      "provenance": "stock_licensed",
      "subject": "person_not_patient",
      "attribution": "Fotógrafo Sintético, banco sintético, licença L-0001",
      "seal": "not_applicable",
      "alt_text": "Pessoa de jaleco olhando para uma prancheta."
    }
  ],
  "exceptions": [
    {
      "ref": "img://job-0001/2",
      "provenance": "owned_photo",
      "subject": "none",
      "attribution": "Acervo próprio, sintético",
      "seal": "not_applicable",
      "alt_text": "Fachada de um consultório, sem pessoas.",
      "approval_id": "00000000-0000-4000-8000-0000000000a1"
    }
  ]
}
